popularity,Pays,title,year,duration,note,n_total,Genre,Director,Acteurs,Public,color,languages,you may like,senario,avis,Descriptions
160,United States,Atlanta,2016–2022,"TV Series,30,m",8.6,74K,"Comedy,Drama,Music",Donald Glover,"Donald Glover,Brian Tyree Henry,LaKeith Stanfield,Zazie Beetz,Khris Davis,RJ Walker,Harold House Moore,Matthew Barnes,Myra Lucretia Taylor,Tobias Segal,Austin Elle Fisher,Adriyan Rae,Katt Williams,Isiah Whitlock Jr.,Cranston Johnson,Griffin Freeman,Hugh Coles,Derrick J. Haywood",2016–2022,,English,"Dave,Barry,It's Always Sunny in Philadelphia,Parks and Recreation,Community,The Bear,Silicon Valley,Guava Island,Master of None,Rick and Morty,The Eric Andre Show,BoJack Horseman",Donald Glover,173,"Earn and his cousin Alfred, based in Atlanta, try to make their way in the world through the rap scene. Along the way they come face-to-face with social and economic issues touching on race, relationships, poverty, status, and parenthood."
"1,827",Turkey,Behzat Ç.: Bir Ankara Polisiyesi,2010–2019,"TV Series,1,h, ,30,m",8.8,30K,"Crime,Drama,Mystery",Erdal Besikçioglu,"Erdal Besikçioglu,Inanç Konukçu,Ege Aydan,Berkan Sal,Mustafa Balci,Ayça Eren,Fatih Artman,Seda Bakan,Eray Eserol,Berke Üzrek,Zeynep Koltuk,Canan Erguder,Hakan Hatipoglu,Elvin Besikcioglu,Nejat Isler,Güven Kiraç,Pelinsu Pir,Ayça Varlier",2010–2019,,Turkish,"Leyla and Mecnun,Ezel,Behzat Ç. Ankara Yaniyor,Behzat Ç.: Seni Kalbime Gömdüm,Avrupa Yakasi,Çekiç ve Gül: Bir Behzat Ç. Hikayesi,Persona,As If,Isler Güçler,The Valley of the Wolves,Masum,G.O.R.A.",,32,"Centered around a personally troubled, officially discredited police chief and his inharmonious police team in Ankara Police Force. Even though the show usually focuses on murders and other crimes that happens on a weekly basis, the undertone of the story leads to an eventual duel between Behzat Ç. and the rotten department officials and bureaucrats."
528,Japan,Naruto: Shippuden,2007–2017,"TV Series,24,m",8.7,127K,"Animation,Action,Adventure",Masashi Kishimoto,"Alexandre Crepet,Junko Takeuchi,Maile Flanagan,Kate Higgins,Chie Nakamura,Dave Wittenberg,Kazuhiko Inoue,Kyle Hebert,Yuri Lowenthal,Noriaki Sugiyama,Masako Katsuki,Debi Mae West,Colleen O'Shaughnessey,Steve Blum,Stephanie Sheh,Shôtarô Morikubo,Tom Gibis,Rikiya Koyama",2007–2017,,Japanese,"Naruto,Jujutsu Kaisen,One Punch Man,Demon Slayer: Kimetsu no Yaiba,Death Note,Hunter x Hunter,One Piece,Boruto: Naruto Next Generations,Attack on Titan,Fullmetal Alchemist: Brotherhood,Dragon Ball Z,Bleach",Alexandre Crepet,360,"Naruto Uzumaki, is a loud, hyperactive, adolescent ninja who constantly searches for approval and recognition, as well as to become Hokage, who is acknowledged as the leader and strongest of all ninja in the village."
725,"Sweden,Denmark,Germany",The Bridge,2011–2018,"TV Series,1,h",8.6,70K,"Crime,Mystery,Thriller",Måns Mårlind,"Sofia Helin,Rafael Pettersson,Sarah Boberg,Dag Malmberg,Kim Bodnia,Puk Scharbau,Thure Lindhardt,Lars Simonsen,Gabriel Flores Jair,Henrik Lundström,Maria Kulle,Julie Carlsen,Emil Birk Hartmann,Anette Lindbäck,Said William Legue,Kristina Brändén Whitaker,Lotte Munk,Vickie Bak Laursen",2011–2018,,"Swedish,Danish","Forbrydelsen,The Killing,The Chestnut Man,The Fall,The Bridge,Broadchurch,Trapped,Luther,Bordertown,Borgen,Line of Duty,True Detective",Sofia Helin,195,"When a body is found on the bridge between Denmark and Sweden, right on the border, Danish inspector Martin Rohde and Swedish Saga Norén have to share jurisdiction and work together to find the killer."
"1,387",Japan,Code Geass,2006–2008,"TV Series,24,m",8.7,69K,"Animation,Action,Drama",Jun Fukuyama,"Jun Fukuyama,Takahiro Sakurai,Johnny Yong Bosch,Yukana,Ami Koshimizu,Yuri Lowenthal,Kate Higgins,Karen Strassman,Brian Beacock,Noriaki Sugiyama,Tetsu Shiratori,Akeno Watanabe,Liam O'Brien,Sayaka Ôhara,Kikuko Inoue,Mitsuaki Madono,Kirk Thornton,Deborah Sale Butler",2006–2008,,Japanese,"Steins;Gate,Fullmetal Alchemist: Brotherhood,Death Note,One Punch Man,Hunter x Hunter,Vinland Saga,Code Geass: Lelouch of the Re;Surrection,Jujutsu Kaisen,Mob Psycho 100,Demon Slayer: Kimetsu no Yaiba,Parasyte: The Maxim,Naruto: Shippuden",,201,"After being given a mysterious power to control others, an outcast prince becomes the masked leader of the rebellion against an all-powerful empire."
172,United States,This Is Us,2016–2022,"TV Series,45,m",8.7,145K,"Comedy,Drama,Romance",Dan Fogelman,"Milo Ventimiglia,Mandy Moore,Sterling K. Brown,Chrissy Metz,Justin Hartley,Susan Kelechi Watson,Chris Sullivan,Eris Baker,Faithe Herman,Jon Huertas,Hannah Zeile,Niles Fitch,Logan Shroyer,Mackenzie Hancsicsak,Parker Bates,Lyric Ross,Lonnie Chavis,Caitlin Thompson",2016–2022,,English,"Big Little Lies,The Marvelous Mrs. Maisel,Downton Abbey,Grey's Anatomy,The Queen's Gambit,Friends,Sex and the City,Shameless,Gilmore Girls,Bridgerton,Schitt's Creek,This Is Us",Milo Ventimiglia,762,"A heartwarming and emotional story about a unique set of triplets, their struggles and their wonderful parents."
"3,385",United States,The Jinx: The Life and Deaths of Robert Durst,2015,"TV Mini Series,4,h, ,39,m",8.6,47K,"Documentary,Biography,Crime",Andrew Jarecki,"Andrew Jarecki,Robert Durst,Gary Napoli,Jeanine Pirro,Debra Kay Anderson,Dick DeGuerin,Michael Simon Hall,Kevin J. Hynes,Chelsea Gonzalez,Susan Berman,Marc Smerling,Charles Bagli,Jeszenia Jimenez,Cody Cazalas,Ellen Strauss,Sareb Kaufman,Gilberte Najamy,Eric Rizk",2015,,English,"Making a Murderer,The Keepers,The Staircase,Wild Wild Country,Don't F**k with Cats: Hunting an Internet Killer,Evil Genius: The True Story of America's Most Diabolical Bank Heist,Tiger King,The Jinx,Capturing the Friedmans,The Trials of Gabriel Fernandez,I Love You, Now Die: The Commonwealth v. Michelle Carter,I'll Be Gone in the Dark",,53,"Filmmaker Andrew Jarecki examines the complicated life of reclusive real estate icon Robert Durst, the key suspect in a series of unsolved crimes."
443,United States,Deadwood,2004–2006,"TV Series,55,m",8.6,108K,"Crime,Drama,History",David Milch,"Timothy Olyphant,Ian McShane,Molly Parker,Brad Dourif,W. Earl Brown,John Hawkes,Paula Malcomson,Dayton Callie,Leon Rippy,William Sanderson,Robin Weigert,Sean Bridgers,Bree Seanna Wall,Jim Beaver,Jeffrey Jones,Kim Dickens,Powers Boothe,Titus Welliver",2004–2006,,"English,Irish Gaelic","Deadwood: The Movie,Boardwalk Empire,Justified,Rome,The Shield,The Wire,Mad Men,Hell on Wheels,Oz,Band of Brothers,Sons of Anarchy,Black Sails",Timothy Olyphant,350,"A show set in the late 1800s, revolving around the characters of Deadwood, South Dakota; a town of deep corruption and crime."
179,United States,Parks and Recreation,2009–2015,"TV Series,22,m",8.6,260K,Comedy,Greg Daniels,"Amy Poehler,Jim O'Heir,Nick Offerman,Chris Pratt,Aubrey Plaza,Aziz Ansari,Retta,Rashida Jones,Adam Scott,Rob Lowe,Jay Jackson,Paul Schneider,Ben Schwartz,Mo Collins,Yvans Jourdain,Jon Glaser,Billy Eichner,James Greene",2009–2015,,English,"Arrested Development,Community,The Office,The Good Place,Brooklyn Nine-Nine,New Girl,30 Rock,Schitt's Creek,A Parks and Recreation Special,It's Always Sunny in Philadelphia,Modern Family,How I Met Your Mother",Amy Poehler,395,The absurd antics of an Indiana town's public officials as they pursue sundry projects to make their city a better place.
177,United States,Dexter,2006–2013,"TV Series,53,m",8.7,726K,"Crime,Drama,Mystery",James Manos Jr.,"Michael C. Hall,Jennifer Carpenter,David Zayas,James Remar,C.S. Lee,Luna Lauren Velez,Desmond Harrington,Julie Benz,Christina Robinson,Geoff Pierson,Preston Bailey,Aimee Garcia,Luke Andrew Kruntchev,Erik King,Evan George Kruntchev,Dana L. Wilson,Yvonne Strahovski,David Ramsey",2006–2013,,"English,Spanish","Dexter: New Blood,House of Cards,House,True Detective,Narcos,Lost,Black Mirror,Sons of Anarchy,Homeland,Sherlock,Mad Men,Mindhunter",Michael C. Hall,969,"He's smart. He's lovable. He's Dexter Morgan, America's favorite serial killer, who spends his days solving crimes and nights committing them. Golden Globe winner Michael C. Hall stars in the hit SHOWTIME Original Series."
"1,772",United Kingdom,Father Ted,1995–1998,"TV Series,25,m",8.7,41K,Comedy,Dermot Morgan,"Dermot Morgan,Ardal O'Hanlon,Frank Kelly,Pauline McLynn,Tony Guilfoyle,Patrick Drury,Rynagh O'Grady,Maurice O'Donoghue,Arthur Mathews,Don Wycherley,Pat Shortt,Jim Norton,Graham Norton,Don Foley,Paul Woodfull,Joe Taylor,Tom Farrelly,Jon Kenny",1995–1998,,English,"Black Books,Fawlty Towers,Blackadder Goes Forth,Peep Show,Blackadder II,Blackadder the Third,The IT Crowd,Spaced,The Thick of It,I'm Alan Partridge,Only Fools and Horses,The Inbetweeners",,122,"Three misfit priests and their housekeeper live on Craggy Island, not the peaceful and quiet part of Ireland that it seems to be."
132,United States,The X-Files,1993–2018,"TV Series,45,m",8.6,227K,"Crime,Drama,Mystery",Chris Carter,"David Duchovny,Gillian Anderson,Mitch Pileggi,William B. Davis,Robert Patrick,Tom Braidwood,Bruce Harwood,Dean Haglund,Annabeth Gish,Nicholas Lea,James Pickens Jr.,Sheila Larken,Chris Owens,Don S. Williams,Steven Williams,Jerry Hardin,Laurie Holden,Rebecca Toolan",1993–2018,,English,"Lost,Star Trek: The Next Generation,The X Files,Westworld,The Simpsons,Fringe,House,The X Files: I Want to Believe,Black Mirror,Dexter,Smallville,Seinfeld",David Duchovny,466,"Two F.B.I. Agents, Fox Mulder the believer and Dana Scully the skeptic, investigate the strange and unexplained, while hidden forces work to impede their efforts."
454,United Kingdom,Line of Duty,2012–2021,"TV Series,1,h",8.7,60K,"Crime,Drama,Mystery",Jed Mercurio,"Martin Compston,Vicky McClure,Adrian Dunbar,Craig Parkinson,Gregory Piper,Aiysha Hart,Maya Sondhi,Keeley Hawes,Nigel Boyle,Polly Walker,Paul Higgins,Anneika Rose,Neil Morrissey,Tomi May,Ace Bhatti,Elizabeth Rider,Tony Pitts,Owen Teale",2012–2021,,,"Luther,Broadchurch,Unforgotten: Body in a Suitcase,Bodyguard,Happy Valley,Unforgotten,The Fall,River,Line of Duty,Marcella,The Night Manager,Doctor Foster: A Woman Scorned",Martin Compston,462,"Drama series following the investigations of AC-12, a controversial police anti-corruption unit."
31,United States,1883,2021–2022,"TV Series,1,h",8.8,69K,"Drama,Western",Taylor Sheridan,"Sam Elliott,Tim McGraw,Faith Hill,Isabel May,LaMonica Garrett,Marc Rissmann,Audie Rick,James Landry Hébert,Gratiela Brancusi,Anna Fiamora,Malcolm Stephenson,Amanda Jaros,Jordan Walker Ross,Stephen Austin Long,Konstantin Melikhov,Eric Nelsen,Noah Le Gros,Josef Bette",2021–2022,,English,"Yellowstone,1923,1883: The Road West,Mayor of Kingstown,Tulsa King,Game of Thrones,The Handmaid's Tale,The Sopranos,Peaky Blinders,Stranger Things,Ted Lasso,The English",Sam Elliott,978,Follows the Dutton family as they embark on a journey west.
"1,882",United States,Justice League Unlimited,2004–2006,"TV Series,23,m",8.7,17K,"Animation,Action,Adventure",Jack Kirby,"George Newbern,Kevin Conroy,Phil LaMarr,Carl Lumbly,Susan Eisenberg,Clancy Brown,Michael Rosenbaum,Maria Canals-Barrera,Kin Shriner,CCH Pounder,Lex Lang,Nicholle Tom,Juliet Landau,Jennifer Hale,Michael Beach,Robert Foxworth,Chris Cox,Powers Boothe",2004–2006,,,"Justice League,Superman: The Animated Series,The New Batman Adventures,Batman: The Animated Series,Teen Titans,X-Men: The Animated Series,Spider-Man: The Animated Series,The Batman,Batman: The Brave and the Bold,Batman: Mask of the Phantasm,The Spectacular Spider-Man,Wolverine and the X-Men",George Newbern,22,A continuation of the Justice League animated series finds the original members of the team joined in their battle against crime and evil by dozens of other heroes from the DC comics universe.
,India,Mahabharat,1988–1990,"TV Series,45,m",9.0,20K,"Adventure,Drama,History",Harish Bhimani,"Harish Bhimani,Nitish Bharadwaj,Mukesh Khanna,Gajendra Chauhan,Praveen Kumar Sobti,Feroz Khan,Roopa Ganguly,Puneet Issar,Pankaj Dheer,Gufi Paintal,Girija Shankar,Surendra Pal,Renuka Israni,Nazneen,Virendra Razdan,Vinod Kapoor,Sameer Chitre,Sanjeev Chitre",1988–1990,,Hindi,"Ramayana: The Legend of Prince Rama,Mahabharat,Tanhaji: The Unsung Warrior,The Tashkent Files,Uri: The Surgical Strike,Akhanda,The Conversion,Panchayat,Luv Kush,M.S. Dhoni: The Untold Story,The Family Man,Chanakya",,139,"When a dynastic struggle between the collateral branches of the Kuru clan, the Kauravas and Pandavas lead them to the threshold of war, Lord Krishna decides to step in and take control of the situation."
"3,764",India,Aspirants,2021– ,"TV Series,45,m",9.2,297K,Drama,Arunabh Kumar,"Naveen Kasturia,Shivankit Singh Parihar,Abhilash Thapliyal,Sunny Hinduja,Akdas Hayat,Namita Dubey,Kuljeet Singh,Bijou Thaangjam,Neetu Jhanjhi,Nupur Nagpal,Darius Chinoy,Udit Kulshrestha,Arpit Bhatia,Rahul Bharadwaj,Preeti Agarwal Mehta,Shivam Kakar,Anurag Thakur,Abhishek Yadav",2021– ,,,"Kota Factory,Panchayat,Scam 1992: The Harshad Mehta Story,TVF Pitchers,The Family Man,Paatal Lok,Asur: Welcome to Your Dark Side,Mirzapur,Special OPS,Special Ops 1.5: The Himmat Story,Sacred Games,Rocket Boys",Naveen Kasturia,6.3K,It is the story of the journey of three UPSC (public service competitive exams in India) aspirants and their friendship against all odds.
"1,987",United Kingdom,The Thick of It,2005–2012,"TV Series,29,m",8.7,24K,Comedy,Armando Iannucci,"Chris Addison,James Smith,Peter Capaldi,Joanna Scanlan,Rebecca Front,Roger Allam,Will Smith,Olivia Poulet,Vincent Franklin,Ben Willbond,Polly Kemp,Lucinda Raikes,Chris Langham,Justin Edwards,Tony Gardner,Samantha Harrington,Geoffrey Streatfeild,Alex Macqueen",2005–2012,,English,"In the Loop,Peep Show,Father Ted,I'm Alan Partridge,Spaced,Fawlty Towers,Blackadder Goes Forth,Blackadder the Third,The Office,Brass Eye,Blackadder II,The IT Crowd",Chris Addison,53,The Minister for Social Affairs is continually harassed by Number 10's policy enforcer and dependent on his not-so-reliable team of civil servants.
831,"United Kingdom,United States",The Grand Tour,2016– ,"TV Series,1,h",8.7,76K,"Comedy,Sport,Talk-Show",Jeremy Clarkson,"Jeremy Clarkson,James May,Richard Hammond,Abbie Eaton,Mike Skinner,Simon Pegg,David Hasselhoff,Kiefer Sutherland,Paris Hilton,Jimmy Carr,John Surtees,Johan Ackermann,Jérôme d'Ambrosio,Tim Burton,Roger Daltrey,Ricky Wilson,Michael Ball,Brian Johnson",2016– ,,English,"Top Gear,Clarkson's Farm,Formula 1: Drive to Survive,James May: Our Man in...,James May: Oh Cook!,The Simpsons,Last Week Tonight with John Oliver,Fawlty Towers,Planet Earth,Top Gear,Futurama,South Park",,384,"Follow Jeremy, Richard and James, as they embark on an adventure across the globe, driving new and exciting automobiles from manufacturers all over the world."
9,United Kingdom,The Crown,2016– ,"TV Series,58,m",8.7,218K,"Biography,Drama,History",Peter Morgan,"Claire Foy,Olivia Colman,Imelda Staunton,Matt Smith,Tobias Menzies,Dominic West,Lesley Manville,Charles Edwards,Elizabeth Debicki,Jonathan Pryce,Vanessa Kirby,Marion Bailey,Victoria Hamilton,Helena Bonham Carter,Pip Torrens,Sam Phillips,Erin Doherty,Will Keen",2016– ,,English,"The Handmaid's Tale,Game of Thrones,Grey's Anatomy,Friends,Stranger Things,Yellowstone,The Queen's Gambit,Bridgerton,The White Lotus,Ted Lasso,Breaking Bad,Black Panther: Wakanda Forever",Claire Foy,839,Follows the political rivalries and romance of Queen Elizabeth II's reign and the events that shaped the second half of the twentieth century.
874,Japan,Berserk,1997–1998,"TV Series,23,m",8.7,40K,"Animation,Action,Adventure",Kentaro Miura,"Marc Diraison,Nobutoshi Canna,Carrie Keranen,Kevin T. Collins,Unshô Ishizuka,Carla Tassara,Jon Avner,Yûko Miyamura,Akira Ishida,Tomohiro Nishimura,Toshiyuki Morikawa,Christopher Kromer,Akiko Yajima,Marc Sebastian,Masuo Amada,Jeff Ward,Michelle Newman,Eiji Sekiguchi",1997–1998,,,"Berserk,Neon Genesis Evangelion,Berserk: The Golden Age Arc I - The Egg of the King,Cowboy Bebop,Berserk: The Golden Age Arc III - The Advent,Monster,Vinland Saga,Code Geass,Berserk: The Golden Age Arc II - The Battle for Doldrey,Samurai Champloo,Fullmetal Alchemist: Brotherhood,One Punch Man",Marc Diraison,132,"Guts is a skilled swordsman who joins forces with a mercenary group named 'The Band of the Hawk', lead by the charismatic Griffith, and fights with them as they battle their way into the royal court."
979,United Kingdom,Top Gear,2002– ,"TV Series,1,h",8.7,119K,"Adventure,Comedy,Reality-TV",Jeremy Clarkson,"Jeremy Clarkson,Richard Hammond,James May,The Stig,Ben Collins,Chris Harris,Andrew Flintoff,Paddy McGuinness,Matt LeBlanc,Rory Reid,Perry McCarthy,Sabine Schmitz,Jason Dawe,Andy Wilman,Chris Evans,Josh Cohen,Tom Chilton,Eddie Jordan",2002– ,,"English,Italian,German,Spanish,French","The Grand Tour,Top Gear,Clarkson's Farm,The Simpsons,South Park,Formula 1: Drive to Survive,Top Gear America,Planet Earth,Futurama,Planet Earth II,Last Week Tonight with John Oliver,Top Gear USA",,170,"The hosts talk about everything car-related. From new cars to how they're fueled, this show has it all."
370,United States,Friday Night Lights,2006–2011,"TV Series,44,m",8.7,67K,"Drama,Sport",Peter Berg,"Kyle Chandler,Connie Britton,Zach Gilford,Aimee Teegarden,Brad Leland,Taylor Kitsch,Jesse Plemons,Derek Phillips,Blue Deckert,Minka Kelly,Adrianne Palicki,Timothy F. Crowley,Louanne Stephens,Stacey Oristano,Scott Porter,Gaius Charles,David Cowgill,Gary Teague",2006–2011,,English,"Friday Night Lights,Parenthood,Mad Men,Bloodline,One Tree Hill,The Newsroom,Entourage,Sons of Anarchy,Making a Murderer,The West Wing,House of Cards,The Last Dance",Kyle Chandler,358,"A drama that follows the lives of the Dillon Panthers, one of the nation's best high school football teams, and their head coach Eric Taylor."
367,United States,House of Cards,2013–2018,"TV Series,51,m",8.7,505K,Drama,Beau Willimon,"Kevin Spacey,Michel Gill,Robin Wright,Kate Mara,Michael Kelly,Justin Doescher,Derek Cecil,Jayne Atkinson,Nathan Darrow,Mahershala Ali,Boris McGiver,Paul Sparks,Molly Parker,Neve Campbell,Jeremy Holm,Marla Aaron Wapner,Nini Le Huynh,Gregory Divers",2013–2018,,English,"Narcos,Homeland,The Queen's Gambit,Mad Men,Mindhunter,True Detective,Dexter,Chernobyl,Black Mirror,Fargo,House of Cards,Sherlock",Kevin Spacey,936,A Congressman works with his equally conniving wife to exact revenge on the people who betrayed him.
"2,357",United Kingdom,The Adventures of Sherlock Holmes,1984–1985,"TV Series,1,h",8.7,23K,"Crime,Drama,Mystery",John Hawkesworth,"Jeremy Brett,David Burke,Rosalie Williams,Eric Porter,Gayle Hunnicutt,Jeremy Kemp,Rosalind Knight,Barbara Wilshere,Norman Jones,David Gwillim,Tenniel Evans,Joss Ackland,Charles Gray,Nicholas Clay,Rosalie Crutchley,Roger Hammond,Betsy Brantley,John Castle",1984–1985,,,"The Return of Sherlock Holmes,The Case-Book of Sherlock Holmes,The Memoirs of Sherlock Holmes,The Sign of Four,The Hound of the Baskervilles,Poirot,Sherlock Holmes,Sherlock Holmes,Yes Minister,Yes, Prime Minister,Sherlock,Blackadder II",Jeremy Brett,65,"Sherlock Holmes and Dr Watson solve the mysteries of copper beeches, a Greek interpreter, the Norwood builder, a resident patient, the red-headed league, and one final problem."
174,United States,Star Trek: The Next Generation,1987–1994,"TV Series,44,m",8.7,121K,"Action,Adventure,Sci-Fi",Gene Roddenberry,"Patrick Stewart,Brent Spiner,Jonathan Frakes,LeVar Burton,Marina Sirtis,Michael Dorn,Gates McFadden,Majel Barrett,Wil Wheaton,Colm Meaney,James G. Becker,Denise Crosby,Whoopi Goldberg,Diana Muldaur,Patti Yasutake,Dennis Madalone,Michelle Forbes,Rosalind Chao",1987–1994,,"English,Klingon,French","Star Trek: Voyager,Star Trek,Star Trek: Deep Space Nine,Star Trek: Enterprise,Star Trek: Picard,Star Trek: First Contact,Star Trek: Generations,Star Trek: Discovery,The X-Files,Star Trek IV: The Voyage Home,Firefly,Star Trek: Nemesis",Patrick Stewart,309,"Set almost 100 years after Captain Kirk's 5-year mission, a new generation of Starfleet officers set off in the U.S.S. Enterprise-D on its own mission to go where no one has gone before."
326,United States,The Marvelous Mrs. Maisel,2017– ,"TV Series,57,m",8.7,115K,"Comedy,Drama",Amy Sherman-Palladino,"Rachel Brosnahan,Alex Borstein,Michael Zegen,Marin Hinkle,Tony Shalhoub,Matteo Pascale,Matilda Szydagis,Kevin Pollak,Nunzio Pascale,Caroline Aaron,Joel Johnstone,Bailey De Young,Brian Tarantina,Luke Kirby,Jane Lynch,Stephanie Hsu,Cynthia Darlow,LeRoy McClain",2017– ,,,"Fleabag,Big Little Lies,Mad Men,Downton Abbey,The Queen's Gambit,The Marvelous Mrs. Maisel presenta The Marvelous Collection,Schitt's Creek,This Is Us,House of Cards,The Morning Show,Parks and Recreation,Arrested Development",Rachel Brosnahan,758,"After her husband leaves her, young mother of two Miriam ""Midge"" Maisel discovers that she has a talent for stand-up comedy. Could this be her calling?"
58,United States,Severance,2022– ,"TV Series,55,m",8.7,117K,"Drama,Mystery,Sci-Fi",Dan Erickson,"Adam Scott,Zach Cherry,Britt Lower,Tramell Tillman,Jen Tullock,Dichen Lachman,Michael Chernus,John Turturro,Christopher Walken,Patricia Arquette,Gwendoline Christie,Alia Shawkat,Merritt Wever,Ólafur Darri Ólafsson,Robby Benson,John Noble,Bob Balaban,Stefano Carannante",2022– ,,,"Ted Lasso,Black Bird,Succession,The Bear,The Morning Show,Black Mirror,Westworld,The Boys,Slow Horses,For All Mankind,The Queen's Gambit,Servant",Adam Scott,829,"Mark leads a team of office workers whose memories have been surgically divided between their work and personal lives. When a mysterious colleague appears outside of work, it begins a journey to discover the truth about their jobs."
196,United States,Mad Men,2007–2015,"TV Series,47,m",8.7,240K,Drama,Matthew Weiner,"Jon Hamm,Elisabeth Moss,Vincent Kartheiser,January Jones,Christina Hendricks,Aaron Staton,Rich Sommer,John Slattery,Kiernan Shipka,Robert Morse,Christopher Stanley,Jessica Paré,Jay R. Ferguson,Michael Gladis,Bryan Batt,Alison Brie,Jared Harris,Kevin Rahm",2007–2015,,English,"House of Cards,Boardwalk Empire,The Wire,The Sopranos,Dexter,Homeland,Fargo,Mad Man,True Detective,Narcos,The Queen's Gambit,Big Little Lies",Jon Hamm,425,"A drama about one of New York's most prestigious ad agencies at the beginning of the 1960s, focusing on one of the firm's most mysterious but extremely talented ad executives, Donald Draper."
833,Japan,Vinland Saga,2019– ,"TV Series,24,m",8.8,39K,"Animation,Action,Adventure",Ray Chase,"Ray Chase,Zach Aguilar,Keith Silverstein,SungWon Cho,Allegra Clark,Patrick Seitz,Ben Diskin,Kira Buckland,Billy Kametz,Kellen Goff,Debi Derryberry,J. Michael Tatum,Abby Trott,Alejandro Saab,Sean Chiplock,Kirk Thornton,Ryan Bartley,Kyle Hebert",2019– ,,Japanese,"Jujutsu Kaisen,One Punch Man,Demon Slayer: Kimetsu no Yaiba,Hunter x Hunter,Steins;Gate,Fullmetal Alchemist: Brotherhood,Mob Psycho 100,Code Geass,Attack on Titan,Death Note,Demon Slayer: Kimetsu no Yaiba - Tsuzumi Mansion Arc,Naruto: Shippuden",,197,Thorfinn pursues a journey with his father's killer in order to take revenge and end his life in a duel as an honorable warrior and pay his father a homage.
896,United Kingdom,Peep Show,2003–2015,"TV Series,25,m",8.7,61K,Comedy,Jesse Armstrong,"David Mitchell,Robert Webb,Matt King,Olivia Colman,Neil Fitzmaurice,Isy Suttie,Paterson Joseph,Sophie Winkleman,Jim Howick,Rachel Blanchard,Elizabeth Marmur,Vera Graziadei,Camilla Beeput,Emily Bruni,Paul Clayton,Cariad Lloyd,Catherine Shepherd,Endy McKay",2003–2015,,,"The Inbetweeners,The Office,The IT Crowd,Father Ted,I'm Alan Partridge,Black Books,Spaced,Peep Show,The Thick of It,Fawlty Towers,That Mitchell and Webb Look,Extras",David Mitchell,110,Mark and Jez are a couple of twenty-something roommates who have nothing in common - except for the fact that their lives are anything but normal. Mayhem ensues as the pair strive to cope with day-to-day life.
"1,452",India,Panchayat,2020– ,"TV Series,35,m",8.9,71K,"Comedy,Drama",Jitendra Kumar,"Jitendra Kumar,Raghuvir Yadav,Chandan Roy,Faisal Malik,Neena Gupta,Sanvikaa,Durgesh Kumar,Biswapati Sarkar,Subhendu Chakraborty,Sushil Tandon,Mubarak Khan,Govind Lobhani,Kamal Rai,Bal Mukund Rai,Salim Ansari,Mohd. Shakir,Dinesh Tiwaru,Kailash Karoshiya",2020– ,,Hindi,"Kota Factory,The Family Man,Aspirants,Scam 1992: The Harshad Mehta Story,Mirzapur,Paatal Lok,Special OPS,Asur: Welcome to Your Dark Side,TVF Pitchers,Sacred Games,Special Ops 1.5: The Himmat Story,M.S. Dhoni: The Untold Story",,1.4K,"A comedy-drama, which captures the journey of an engineering graduate Abhishek, who for lack of a better job option joins as secretary of a Panchayat office in a remote village of Uttar Pradesh."
422,United States,Invincible,2021– ,"TV Series,50,m",8.7,137K,"Animation,Action,Adventure",Robert Kirkman,"Steven Yeun,J.K. Simmons,Sandra Oh,Zazie Beetz,Grey Griffin,Kevin Michael Richardson,Walton Goggins,Gillian Jacobs,Zachary Quinto,Andrew Rannells,Jason Mantzoukas,Khary Payton,Melise,Chris Diamantopoulos,Ross Marquand,Max Burkholder,Mark Hamill,Clancy Brown",2021– ,,,"The Boys,Arcane,One Punch Man,Rick and Morty,The Mandalorian,Daredevil,Death Note,Vinland Saga,Attack on Titan,BoJack Horseman,Loki,Castlevania",Steven Yeun,775,An adult animated series based on the Skybound/Image comic about a teenager whose father is the most powerful superhero on the planet.
