popularity,Pays,title,year,duration,note,n_total,Genre,Director,Acteurs,Public,color,languages,you may like,senario,avis,Descriptions
,India,Sarabhai V/S Sarabhai,2004–2017,"TV Series,30,m",9.0,17K,Comedy,Satish Shah,"Satish Shah,Ratna Pathak Shah,Sumeet Raghavan,Rupali Ganguly,Rajesh Kumar,Ghanshyam Nayak,Deven Bhojani,Arvind Vaidya,Shilpa Mehta,Rita Bhaduri,Sheetal Thakkar,Vaibhavi Upadhyaya,Aishwarya Sakhuja,Gurpal Singh,Gerald Stone,Aatish Kapadia,Jamnadas Majethia,Tarla Joshi",2004–2017,,"Hindi,Gujarati,English","Khichdi,Mahabharat,TVF Pitchers,Office Office,Kota Factory,Baa Bahoo Aur Baby,Panchayat,Malgudi Days,Tu Tu Main Main,Scam 1992: The Harshad Mehta Story,Dekh Bhai Dekh,Shrimaan Shrimati",,61,"The show revolves around the lives of the members of an Uber Wealthy - High Society Gujarati family of Cuffe Parade - South Bombay, whose daughter-in-law is from a middle class Delhi background."
237,United Kingdom,Downton Abbey,2010–2015,"TV Series,58,m",8.7,208K,"Drama,Romance",Julian Fellowes,"Hugh Bonneville,Phyllis Logan,Elizabeth McGovern,Brendan Coyle,Laura Carmichael,Jim Carter,Michelle Dockery,Joanne Froggatt,Robert James-Collier,Sophie McShera,Lesley Nicol,Maggie Smith,Penelope Wilton,Kevin Doyle,Allen Leech,David Robb,Siobhan Finneran,Dan Stevens",2010–2015,,English,"Downton Abbey,Downton Abbey: A New Era,Bridgerton,Outlander,The Queen's Gambit,Mad Men,The Crown,House of Cards,Big Little Lies,Pride and Prejudice,Sex and the City,The Marvelous Mrs. Maisel",Hugh Bonneville,339,A chronicle of the lives of the British aristocratic Crawley family and their servants in the early twentieth century.
"2,633",India,Gullak,2019– ,"TV Series,24,m",9.1,17K,"Comedy,Drama,Family",Shreyansh Pandey,"Jameel Khan,Geetanjali Kulkarni,Vaibhav Raj Gupta,Harsh Mayar,Shivankit Singh Parihar,Sunita Rajwar,Saad Bilgrami,Deepak Kumar Mishra,Akdas Hayat,Bilal Khan,Gaurav Sarathe,Sachin Chaudhary,Abhishake Jha,Amar Singh Parihar,Ashwini,Stuti Tiwari,Vishwanath Chatterjee,Ajay Pal",2019– ,,Hindi,"Yeh Meri Family,Ghar Waapsi,Nirmal Pathak Ki Ghar Wapsi,Ramayan,Sharmaji Namkeen,Let's Go! India,Taarak Mehta Ka Ooltah Chashmah,Jug Jugg Jeeyo,Like Stars on Earth,Shaktimaan,Kapoor & Sons,Children's Party",Jameel Khan,547,"Set in quaint by-lanes in the heart of India, Gullak is a collection of disarming and relatable tales of the Mishra family."
26,United States,Stranger Things,2016– ,"TV Series,51,m",8.7,1.2M,"Drama,Fantasy,Horror",Millie Bobby Brown,"Millie Bobby Brown,Finn Wolfhard,Winona Ryder,David Harbour,Gaten Matarazzo,Caleb McLaughlin,Natalia Dyer,Charlie Heaton,Joe Keery,Noah Schnapp,Cara Buono,Priah Ferguson,Sadie Sink,Maya Hawke,Brett Gelman,Joe Chrest,Paul Reiser,Dacre Montgomery",2016– ,,"English,Russian","Breaking Bad,Game of Thrones,The Boys,Peaky Blinders,Rick and Morty,Friends,You,Dark,Joker,The Queen's Gambit,The Walking Dead,Black Mirror",,3.7K,"When a young boy disappears, his mother, a police chief and his friends must confront terrifying supernatural forces in order to get him back."
561,United States,Battlestar Galactica,2004–2009,"TV Series,44,m",8.7,167K,"Action,Adventure,Drama",Glen A. Larson,"Edward James Olmos,Mary McDonnell,Jamie Bamber,James Callis,Tricia Helfer,Grace Park,Katee Sackhoff,Michael Hogan,Aaron Douglas,Tahmoh Penikett,Alessandro Juliani,Kandyse McClure,Bodie Olmos,Donnelly Rhodes,Michael Trucco,Nicki Clyne,Leah Cairns,Rekha Sharma",2004–2009,,English,"Battlestar Galactica,Firefly,Battlestar Galactica: Razor,Stargate: Atlantis,Battlestar Galactica: The Plan,Stargate SG-1,Star Trek: The Next Generation,The Expanse,Battlestar Galactica,Serenity,Fringe,The X-Files",Edward James Olmos,835,"When an old enemy, the Cylons, resurface and obliterate the 12 colonies, the crew of the aged Galactica protect a small civilian fleet - the last of humanity - as they journey toward the fabled 13th colony, Earth."
85,United States,House,2004–2012,"TV Series,44,m",8.7,465K,"Drama,Mystery",David Shore,"Hugh Laurie,Omar Epps,Robert Sean Leonard,Jesse Spencer,Lisa Edelstein,Bobbin Bergstrom,Jennifer Morrison,Peter Jacobson,Olivia Wilde,Kal Penn,Odette Annable,Charlyne Yi,Anne Dudek,Jennifer Crystal Foley,Amber Tamblyn,Liz Benoit,Stephanie Venditto,Sela Ward",2004–2012,,English,"Dexter,Sherlock,The Big Bang Theory,House of Cards,Suits,Friends,Hekimoglu,The Queen's Gambit,How I Met Your Mother,Bones,The Mentalist,Black Mirror",Hugh Laurie,668,An antisocial maverick doctor who specializes in diagnostic medicine does whatever it takes to solve puzzling cases that come his way using his crack team of doctors and his wits.
711,United States,The Shield,2002–2008,"TV Series,47,m",8.7,81K,"Crime,Drama,Thriller",Shawn Ryan,"Michael Chiklis,Jay Karnes,Michael Jace,CCH Pounder,Walton Goggins,Benito Martinez,Catherine Dent,Cathy Cahlin Ryan,David Rees Snell,Kenny Johnson,David Marciano,Autumn Chiklis,Paula Garcés,Michele Hicks,Melanie Myers,Joel Rosenthal,Matt Corboy,Chaney Kley",2002–2008,,English,"Oz,Justified,Deadwood,Boardwalk Empire,Sons of Anarchy,The Wire,Six Feet Under,Mad Men,Rome,Dexter,Fargo,Band of Brothers",Michael Chiklis,471,Drama series following the lives and cases of dirty cop Vic Mackey and the LAPD unit under his command.
817,Japan,One Punch Man,2015–2019,"TV Series,24,m",8.7,160K,"Animation,Action,Comedy",Makoto Furukawa,"Makoto Furukawa,Kaito Ishikawa,Max Mittelman,Zach Aguilar,Hiromichi Tezuka,Robbie Daymond,Kyle Hebert,Shôta Yamamoto,Yôji Ueda,Sean Chiplock,Yoshiaki Hasegawa,Kirk Thornton,Shin'ya Hamazoe,Bill Rogers,Hikaru Midorikawa,Ben Lepley,Ben Pronsky,Koichi Soma",2015–2019,,"Japanese,English","Death Note,Jujutsu Kaisen,Fullmetal Alchemist: Brotherhood,Demon Slayer: Kimetsu no Yaiba,Hunter x Hunter,Mob Psycho 100,Naruto: Shippuden,Attack on Titan,Vinland Saga,My Hero Academia,Dragon Ball Z,Steins;Gate",,361,"The story of Saitama, a hero that does it just for fun & can defeat his enemies with a single punch."
101,United States,The Simpsons,1989– ,"TV Series,22,m",8.7,408K,"Animation,Comedy",James L. Brooks,"Dan Castellaneta,Nancy Cartwright,Harry Shearer,Julie Kavner,Yeardley Smith,Hank Azaria,Pamela Hayden,Tress MacNeille,Maggie Roswell,Chris Edgerly,Karl Wiedergott,Russi Taylor,Marcia Wallace,Kevin Michael Richardson,Phil Hartman,Joe Mantegna,Alex Désert,Maurice LaMarche",1989– ,,English,"Family Guy,South Park,Futurama,The Simpsons Movie,American Dad!,Rick and Morty,The Simpsons: Family Portrait,The Big Bang Theory,Bob's Burgers,Seinfeld,Friends,Modern Family",Dan Castellaneta,890,The satiric adventures of a working-class family in the misfit city of Springfield.
30,United States,The Boys,2019– ,"TV Series,1,h",8.7,500K,"Action,Comedy,Crime",Eric Kripke,"Karl Urban,Jack Quaid,Antony Starr,Erin Moriarty,Jessie T. Usher,Laz Alonso,Chace Crawford,Tomer Capone,Karen Fukuhara,Nathan Mitchell,Dominique McElligott,Colby Minifie,Claudia Doumit,Nneka Elliott,Laila Robins,Aya Cash,Katy Breier,Elisabeth Shue",2019– ,,English,"Stranger Things,Breaking Bad,Invincible,The Mandalorian,Rick and Morty,Game of Thrones,Better Call Saul,The Office,Supernatural,Peaky Blinders,Butcher: a Short Film,Joker",Karl Urban,2.6K,A group of vigilantes set out to take down corrupt superheroes who abuse their superpowers.
291,United Kingdom,Fleabag,2016–2019,"TV Series,27,m",8.7,158K,"Comedy,Drama",Phoebe Waller-Bridge,"Phoebe Waller-Bridge,Sian Clifford,Olivia Colman,Jenny Rainsford,Bill Paterson,Brett Gelman,Andrew Scott,Hugh Skinner,Ben Aldridge,Hugh Dennis,Jamie Demetriou,Kae Alexander,Anthony Welsh,Ray Fearon,Christian Hillborg,David Hargreaves,Angus Imrie,Christopher Colquhoun",2016–2019,,English,"Normal People,The Queen's Gambit,Crashing,Big Little Lies,Unorthodox,Killing Eve,The Marvelous Mrs. Maisel,I May Destroy You,National Theatre Live: Fleabag,Sex Education,Black Mirror,The End of the F***ing World",Phoebe Waller-Bridge,655,A comedy series adapted from the award-winning play about a young woman trying to cope with life in London whilst coming to terms with a recent tragedy.
258,United States,Arrested Development,2003–2019,"TV Series,22,m",8.7,306K,Comedy,Mitchell Hurwitz,"Jason Bateman,Michael Cera,Portia de Rossi,Will Arnett,Alia Shawkat,Tony Hale,David Cross,Jeffrey Tambor,Jessica Walter,Ron Howard,Henry Winkler,John Beard,Liza Minnelli,Mae Whitman,Justin Grant Wade,Ed Begley Jr.,Isla Fisher,Maria Bamford",2003–2019,,,"Parks and Recreation,Community,30 Rock,It's Always Sunny in Philadelphia,Arrested Development,The Good Place,Freaks and Geeks,Curb Your Enthusiasm,Schitt's Creek,Brooklyn Nine-Nine,New Girl,The Office",Jason Bateman,480,"Level-headed son Michael Bluth takes over family affairs after his father is imprisoned. But the rest of his spoiled, dysfunctional family are making his job unbearable."
32,"Germany,United States",Dark,2017–2020,"TV Series,1,h",8.7,387K,"Crime,Drama,Mystery",Baran bo Odar,"Louis Hofmann,Karoline Eichhorn,Lisa Vicari,Maja Schöne,Jördis Triebel,Andreas Pietschmann,Stephan Kampwirth,Paul Lux,Oliver Masucci,Moritz Jahn,Peter Benedict,Gina Stiebitz,Deborah Kaufmann,Daan Lennard Liebrenz,Julika Jenkins,Carlotta von Falkenhayn,Dietrich Hollinderbäumer,Mark Waschke",2017–2020,,German,"1899,Stranger Things,Chernobyl,Black Mirror,Game of Thrones,Breaking Bad,The Queen's Gambit,Peaky Blinders,Money Heist,Sherlock,The Boys,You",Louis Hofmann,3.9K,"A family saga with a supernatural twist, set in a German town where the disappearance of two young children exposes the relationships among four families."
81,United States,The Mandalorian,2019– ,"TV Series,40,m",8.7,478K,"Action,Adventure,Fantasy",Jon Favreau,"Pedro Pascal,Carl Weathers,Giancarlo Esposito,Chris Bartlett,Barry Lowin,Gina Carano,Leilani Shiu,Misty Rosas,Omid Abtahi,Temuera Morrison,Ming-Na Wen,Katy M. O'Brian,Rio Hackford,Amy Sedaris,Emily Swallow,Nick Nolte,Werner Herzog,Taika Waititi",2019– ,,English,"The Book of Boba Fett,Obi-Wan Kenobi,Rogue One: A Star Wars Story,The Boys,Loki,Star Wars: Episode V - The Empire Strikes Back,Star Wars: Episode III - Revenge of the Sith,Stranger Things,Star Wars: Episode IV - A New Hope,Star Wars: The Clone Wars,Kenobi: A Star Wars Story,Solo: A Star Wars Story",Pedro Pascal,3K,"The travels of a lone bounty hunter in the outer reaches of the galaxy, far from the authority of the New Republic."
"1,440",Japan,Steins;Gate,2011–2015,"TV Series,24,m",8.8,63K,"Animation,Comedy,Drama",Mamoru Miyano,"Mamoru Miyano,Asami Imai,Kana Hanazawa,Ashly Burch,J. Michael Tatum,Trina Nishimura,Tomokazu Seki,Tyson Rinehart,Cherami Leigh,Yukari Tamura,Saori Gotô,Yû Kobayashi,Masaki Terasoma,Jessica Cavanagh,Christopher Sabat,Lindsay Seidel,Haruko Momoi,Ayano Yamamoto",2011–2015,,"Japanese,English","Steins;Gate 0,Code Geass,Fullmetal Alchemist: Brotherhood,One Punch Man,Death Note,Steins;Gate: The Movie - Load Region of Déjà Vu,Hunter x Hunter,Vinland Saga,Mob Psycho 100,Your Lie in April,Erased,Attack on Titan",,246,"After discovering time travel, a university student and his colleagues must use their knowledge of it to stop an evil organization and their diabolical plans."
"1,625",India,Kota Factory,2019–2021,"TV Series,45,m",9.1,72K,"Comedy,Drama",Saurabh Khanna,"Mayur More,Jitendra Kumar,Ranjan Raj,Alam Khan,Revathi Pillai,Urvi Singh,Harish Peddinti,Ahsaas Channa,Sameer Saxena,Vaibhav Thakkar,Arun Kumar,Akdas Hayat,Abhishake Jha,Sachin Vidrohi,Jyoti Gauba,Rajesh Kumar,Abhaya Sharma,Jaiti Khera",2019–2021,,Hindi,"Aspirants,Panchayat,The Family Man,TVF Pitchers,Scam 1992: The Harshad Mehta Story,Mirzapur,Sacred Games,Asur: Welcome to Your Dark Side,Paatal Lok,Special OPS,Special Ops 1.5: The Himmat Story,M.S. Dhoni: The Untold Story",Mayur More,557,"Dedicated to Shrimati SL Loney ji, Shri Irodov ji and Maanniya HC Verma ji, 'Kota Factory' is TVF's latest original. India's first 'Black and White' show highlights the problems present day IIT-JEE aspirants face in their day-to-day lives."
"1,098",United States,Over the Garden Wall,2014,"TV Mini Series,22,m",8.8,57K,"Animation,Short,Adventure",Katie Krentz,"Elijah Wood,Collin Dean,Melanie Lynskey,Christopher Lloyd,Samuel Ramey,Jack Jones,John Cleese,Emily Brundige,Shirley Jones,Fred Stoller,Cole Sanchez,Sam Marin,Chris Isaak,Janet Klein,Tim Curry,Bebe Neuwirth,Noureen DeWulf,Deborah Voigt",2014,,,"Gravity Falls,Adventure Time,Steven Universe,Infinity Train,Regular Show,The Amazing World of Gumball,Avatar: The Last Airbender,Adventure Time: Distant Lands,The Owl House,Hilda,Amphibia,Star vs. the Forces of Evil",Elijah Wood,187,Two brothers find themselves lost in a mysterious land and try to find their way home.
51,United Kingdom,Peaky Blinders,2013–2022,"TV Series,1,h",8.8,548K,"Crime,Drama",Steven Knight,"Cillian Murphy,Paul Anderson,Sophie Rundle,Helen McCrory,Ned Dennehy,Finn Cole,Natasha O'Keeffe,Ian Peck,Harry Kirton,Packy Lee,Joe Cole,Annabelle Wallis,Kate Phillips,Aimee-Ffion Edwards,Tony Pitts,Benjamin Zephaniah,Tom Hardy,Jordan Bolger",2013–2022,,"English,Romanian,Irish Gaelic,Italian,Yiddish,French","Breaking Bad,Game of Thrones,Stranger Things,Vikings,Narcos,Chernobyl,The Queen's Gambit,Sherlock,Better Call Saul,Peaky Blinders,The Boys,Black Mirror",Cillian Murphy,1.2K,"A gangster family epic set in 1900s England, centering on a gang who sew razor blades in the peaks of their caps, and their fierce boss Tommy Shelby."
515,United States,Oz,1997–2003,"TV Series,55,m",8.7,100K,"Crime,Drama,Thriller",Tom Fontana,"Ernie Hudson,J.K. Simmons,Lee Tergesen,Dean Winters,George Morfogen,Terry Kinney,Rita Moreno,Harold Perrineau,Eamonn Walker,Craig muMs Grant,Luna Lauren Velez,Granville Adams,Tom Mardirosian,Kirk Acevedo,BD Wong,Chuck Zito,Philip Scozzarella,Scott William Winters",1997–2003,,,"The Shield,Six Feet Under,The Wire,Boardwalk Empire,Deadwood,Rome,The Sopranos,Sons of Anarchy,Dexter,Mad Men,Fargo,House of Cards",Ernie Hudson,212,A series chronicling the daily activities of an unusual prison facility and its criminal inhabitants.
471,United States,Six Feet Under,2001–2005,"TV Series,1,h",8.7,136K,"Comedy,Drama",Alan Ball,"Peter Krause,Michael C. Hall,Frances Conroy,Lauren Ambrose,Freddy Rodríguez,Mathew St. Patrick,Rachel Griffiths,Justina Machado,Jeremy Sisto,Brenna Tosh,Bronwyn Tosh,James Cromwell,Lili Taylor,Ben Foster,Joanna Cassidy,Richard Jenkins,Giancarlo Rodriguez,Ed O'Ross",2001–2005,,English,"Oz,Mad Men,Dexter,Twin Peaks,The Shield,Boardwalk Empire,The Wire,House of Cards,6 Feet Under,Fargo,The Sopranos,Deadwood",Peter Krause,373,A chronicle of the lives of a dysfunctional family who run an independent funeral home in Los Angeles.
48,United States,Ted Lasso,2020– ,"TV Series,30,m",8.8,214K,"Comedy,Drama,Sport",Brendan Hunt,"Jason Sudeikis,Brett Goldstein,Brendan Hunt,Nick Mohammed,Hannah Waddingham,Jeremy Swift,Phil Dunster,Juno Temple,Toheeb Jimoh,Kola Bokinni,Billy Harris,Stephen Manas,Cristo Fernández,Moe Jeudy-Lamour,Annette Badland,Adam Colborne,Bronson Webb,Kevin Garry",2020– ,,,"Severance,The Office,Succession,Game of Thrones,Friends,The Morning Show,Stranger Things,The Boys,Breaking Bad,Ted Lasso: The Missing Christmas Mustache,The Sopranos,Peaky Blinders",Jason Sudeikis,1.5K,"American college football coach Ted Lasso heads to London to manage AFC Richmond, a struggling English Premier League football team."
505,"United Kingdom,United States",Rome,2005–2007,"TV Series,52,m",8.7,173K,"Action,Drama,Romance",Bruno Heller,"Kevin McKidd,Ray Stevenson,Polly Walker,Kerry Condon,James Purefoy,Ian McNeice,Coral Amiga,Lindsay Duncan,Lidia Biondi,Tobias Menzies,Nicholas Woodeson,David Bamber,Chiara Mastalli,Manfredi Aliquo,Indira Varma,Suzanne Bertish,Max Pirkis,Lee Boardman",2005–2007,,,"Spartacus,Spartacus: Gods of the Arena,Deadwood,Boardwalk Empire,Black Sails,Band of Brothers,Oz,The Tudors,The Pacific,Narcos,Marco Polo,I, Claudius",Kevin McKidd,301,A down-to-earth account of the lives of both illustrious and ordinary Romans set in the last days of the Roman Republic.
143,Japan,One Piece,1999– ,"TV Series,24,m",8.9,126K,"Animation,Action,Adventure",Eiichirô Oda,"Mayumi Tanaka,Laurent Vernin,Tony Beck,Akemi Okamura,Kappei Yamaguchi,Kazuya Nakai,Hiroaki Hirata,Ikue Ôtani,Colleen Clinkenbeard,Yuriko Yamaguchi,Mahito Ôba,Kazuki Yao,Chikao Ôtsuka,Luci Christian,Christopher Sabat,Sonny Strait,Eric Vale,Chô",1999– ,,Japanese,"Naruto: Shippuden,Hunter x Hunter,Naruto,One Piece Film: Red,Attack on Titan,One Punch Man,Fullmetal Alchemist: Brotherhood,Jujutsu Kaisen,Demon Slayer: Kimetsu no Yaiba,Death Note,Bleach,Dragon Ball Z",Mayumi Tanaka,477,"Follows the adventures of Monkey D. Luffy and his pirate crew in order to find the greatest treasure ever left by the legendary Pirate, Gold Roger. The famous mystery treasure named ""One Piece""."
"2,253",United Kingdom,"I, Claudius",1976,"TV Mini Series,11,h, ,9,m",8.9,18K,"Biography,Drama,History",Derek Jacobi,"Derek Jacobi,John Hurt,Siân Phillips,Brian Blessed,George Baker,Margaret Tyzack,James Faulkner,Patricia Quinn,Patrick Stewart,Fiona Walker,Kevin McNally,Sheila White,Bernard Hepton,John Cater,Frances White,David Robb,Freda Dowie,Roger Bizley",1976,,,"Blackadder Goes Forth,Rome,Fawlty Towers,Monty Python's Flying Circus,Yes Minister,Yes, Prime Minister,Blackadder II,Das Boot,The Civil War,The World at War,I, Claudius,Blackadder the Third",,132,"The personal and governmental affairs of the Julio-Claudian dynasty at the beginning of the Roman Empire, as recalled by one of its rulers."
215,United States,South Park,1997– ,"TV Series,22,m",8.7,370K,"Animation,Comedy",Trey Parker,"Trey Parker,Matt Stone,Isaac Hayes,Mona Marshall,April Stewart,Adrien Beard,Eliza Schneider,Jennifer Howell,Jessica Makinson,Mary Kay Bergman,Omaira Coromoto Rivero,Betty Boogie Parker,Vernon Chatman,Kyle McCulloch,John 'Nancy' Hansen,Elisa Gabrielli,Jonathan Kimmel,Milan Agnone",1997– ,,English,"The Simpsons,Futurama,Family Guy,South Park: Bigger, Longer & Uncut,American Dad!,Rick and Morty,BoJack Horseman,Bob's Burgers,Black Mirror,Archer,Parks and Recreation,King of the Hill",Trey Parker,549,"Follows the misadventures of four irreverent grade-schoolers in the quiet, dysfunctional town of South Park, Colorado."
703,"Japan,United States,Canada",Dragon Ball Z,1989–1996,"TV Series,24,m",8.8,132K,"Animation,Action,Adventure",Doc Harris,"Doc Harris,Christopher Sabat,Scott McNeil,Sean Schemmel,Terry Klassen,Brian Drummond,Sonny Strait,Stephanie Nadolny,Don Brown,Tiffany Vollmer,Dale Kelly,Cathy Weseluck,Kyle Hebert,Michael Dobson,Kirby Morrow,Jillian Michaels,Ted Cole,Cynthia Cranz",1989–1996,,"Japanese,English","Dragon Ball,Dragon Ball Z,Dragon Ball,One Punch Man,Dragon Ball GT,Death Note,Naruto: Shippuden,Fullmetal Alchemist: Brotherhood,Dragon Ball Z Kai,Naruto,Hunter x Hunter,One Piece",,197,"With the help of the powerful Dragonballs, a team of fighters led by the saiyan warrior Goku defend the planet earth from extraterrestrial enemies."
"2,179",United States,Chappelle's Show,2003–2006,"TV Series,22,m",8.8,65K,"Comedy,Music",Neal Brennan,"Dave Chappelle,Donnell Rawlings,Rudy Rush,Charlie Murphy,Neal Brennan,Yasiin Bey,Randy Pearlstein,Melle Powers,Greer Barnes,Blaire Reinhard,Yoshio Mita,Paul Mooney,Guillermo Diaz,William Bogert,Sophina Brown,Questlove,Bryan Olsen,Bill Burr",2003–2006,,English,"Curb Your Enthusiasm,South Park,It's Always Sunny in Philadelphia,Key and Peele,Workaholics,Freaks and Geeks,Arrested Development,Last Week Tonight with John Oliver,Seinfeld,Dave Chappelle: The Closer,Parks and Recreation,Dave Chappelle: Sticks & Stones",Dave Chappelle,109,Comedian Dave Chappelle hosts this sketch-comedy show that parodies many of the nuances of race and culture.
"3,612",,Dragon Ball Z,1989–1996,"TV Series,24,m",8.8,80K,"Animation,Action,Adventure",Jôji Yanami,"Jôji Yanami,Kyle Hebert,Masako Nozawa,Sean Schemmel,Christopher Sabat,Mayumi Tanaka,Sonny Strait,Stephanie Nadolny,Toshio Furukawa,Ryô Horikawa,Hiromi Tsuru,Tiffany Vollmer,Mike McFarland,Cynthia Cranz,Hirotaka Suzuoki,Daisuke Gôri,Takeshi Kusao,Tôru Furuya",1989–1996,,,"Dragon Ball Z,Dragon Ball,Dragon Ball,Dragon Ball GT,Dragon Ball Z Kai,One Punch Man,Naruto: Shippuden,Death Note,Dragon Ball: Curse of the Blood Rubies,Hunter x Hunter,Fullmetal Alchemist: Brotherhood,Naruto",,60,"The adventures of Earth's martial arts defender, Son Goku, continue with a new family and the revelation of his alien origins. Now Goku and his allies must defend the planet from an onslaught of new extraterrestrial enemies."
214,United States,BoJack Horseman,2014–2020,"TV Series,25,m",8.8,158K,"Animation,Comedy,Drama",Raphael Bob-Waksberg,"Will Arnett,Amy Sedaris,Alison Brie,Aaron Paul,Paul F. Tompkins,Adam Conover,Keith Olbermann,Diedrich Bader,Kristen Schaal,Patton Oswalt,Raphael Bob-Waksberg,Aparna Nancherla,J.K. Simmons,Stanley Tucci,Wendie Malick,Angela Bassett,Rami Malek,Stephanie Beatriz",2014–2020,,,"Rick and Morty,South Park,Black Mirror,Horsin' Around,Disenchantment,Futurama,Big Mouth,The Office,Invincible,Breaking Bad,The End of the F***ing World,Community",Will Arnett,588,"BoJack Horseman was the star of the hit television show ""Horsin' Around"" in the '80s and '90s, but now he's washed up, living in Hollywood, complaining about everything, and wearing colorful sweaters."
319,"United States,Colombia",Narcos,2015–2017,"TV Series,49,m",8.8,422K,"Biography,Crime,Drama",Carlo Bernard,"Pedro Pascal,Wagner Moura,Boyd Holbrook,Alberto Ammann,Paulina Gaitan,Juan Murcia,Jorge Monterrosa,Damián Alcázar,Francisco Denis,Raúl Méndez,Juan Sebastián Calero,Paulina García,Diego Cataño,Brett Cullen,Julián Díaz,Joanna Christie,Maurice Compte,María José Sanchez Real",2015–2017,,"English,Spanish","Narcos: Mexico,Chernobyl,House of Cards,True Detective,Black Mirror,Peaky Blinders,The Queen's Gambit,Mindhunter,Sherlock,Breaking Bad,Prison Break,Fargo",Pedro Pascal,481,"A chronicled look at the criminal exploits of Colombian drug lord Pablo Escobar, as well as the many other drug kingpins who plagued the country through the years."
365,Turkey,As If,2021– ,"TV Series,30,m",9.0,14K,Comedy,Feyyaz Yigit,"Feyyaz Yigit,Kivanç Kilinç,Ahmet Kürsat Öçalan,Ezgi Ay,Ümran Sakir,Celal Öztürk,Burcu Oktav,Özer Arslan,Eray Sel,Ozan Elatunterin,Burak Gunes,Ferda Isil,Mustafa Erkan,Rasim Can Günes,Kerem Akti,Deniz Goktas,Ertan Ekmekci,Eray Sargin",2021– ,,Turkish,"Leyla and Mecnun,Persona,Mortal World,The Life and Movies of Erşan Kuneri,Ayak Isleri,Behzat Ç.: Bir Ankara Polisiyesi,Ethos,Cem Yilmaz: Diamond Elite Platinum Plus,Cinayet Süsü,G.O.R.A.,Avrupa Yakasi,Masum",,35,Yilmaz and Ilkkan are two friends who are constantly fighting each other. Their greatest feature is always being able to do something that will turn their ordinary lives upside down.
73,"United Kingdom,United States",Black Mirror,2011–2019,"TV Series,1,h",8.8,546K,"Drama,Mystery,Sci-Fi",Charlie Brooker,"Daniel Lapaine,Hannah John-Kamen,Michaela Coel,Beatrice Robertson-Jones,Charles Babalola,Aaron Paul,Anjana Vasan,Daniel Kaluuya,Toby Kebbell,Rory Kinnear,Hayley Atwell,Lenora Crichlow,Daniel Rigby,Jon Hamm,Bryce Dallas Howard,Kelly Macdonald,Alex Lawther,Gugu Mbatha-Raw",2011–2019,,English,"The Queen's Gambit,Chernobyl,Sherlock,Narcos,Dark,True Detective,Stranger Things,Breaking Bad,Westworld,Rick and Morty,Game of Thrones,Black Mirror: Bandersnatch",Daniel Lapaine,906,"An anthology series exploring a twisted, high-tech multiverse where humanity's greatest innovations and darkest instincts collide."
"4,273",United Kingdom,Blackadder Goes Forth,1989,"TV Series,2,h, ,55,m",8.8,53K,"Comedy,War",Rowan Atkinson,"Rowan Atkinson,Tony Robinson,Stephen Fry,Hugh Laurie,Tim McInnerny,Gabrielle Glaister,Miranda Richardson,Rik Mayall,Geoffrey Palmer,Jeremy Hardy,Adrian Edmondson,Stephen Frost,Bill Wallis,Hugo Blick,Lee Cornes,Paul Mark Elliott,Jeremy Gittins,Russell Brook",1989,,English,"Blackadder the Third,Blackadder II,Blackadder,Blackadder Back & Forth,Fawlty Towers,Blackadder's Christmas Carol,Blackadder: The Cavalier Years,Monty Python's Flying Circus,Father Ted,Only Fools and Horses,Blackadder Rides Again,Black Books",,79,"Stuck in the middle of World War I, Captain Edmund Blackadder does his best to escape the banality of the war."
62,United States,Succession,2018– ,"TV Series,1,h",8.8,149K,Drama,Jesse Armstrong,"Nicholas Braun,Peter Friedman,Matthew Macfadyen,Brian Cox,Kieran Culkin,Alan Ruck,Sarah Snook,Jeremy Strong,J. Smith-Cameron,Scott Nicholson,Hiam Abbass,Dagmara Dominczyk,Justine Lupe,Arian Moayed,David Rasche,Rob Yang,Juliana Canfield,Fisher Stevens",2018– ,,English,"Ted Lasso,True Detective,Severance,The Sopranos,The Wire,Fargo,Chernobyl,Peaky Blinders,Narcos,Mad Men,House of Cards,Westworld",Nicholas Braun,968,"The Roy family is known for controlling the biggest media and entertainment company in the world. However, their world changes when their father steps down from the company."
335,United States,Twin Peaks,1990–1991,"TV Series,47,m",8.8,198K,"Crime,Drama,Mystery",Mark Frost,"Kyle MacLachlan,Michael Ontkean,Mädchen Amick,Dana Ashbrook,Richard Beymer,Lara Flynn Boyle,Sherilyn Fenn,Warren Frost,Peggy Lipton,James Marshall,Everett McGill,Jack Nance,Joan Chen,Kimmy Robertson,Michael Horse,Piper Laurie,Harry Goaz,Eric DaRe",1990–1991,,,"Twin Peaks,Twin Peaks: Fire Walk with Me,Twin Peaks: The Missing Pieces,Fargo,Mulholland Drive,True Detective,Blue Velvet,Lost Highway,Monty Python's Flying Circus,The X-Files,Eraserhead,Inland Empire",Kyle MacLachlan,328,An idiosyncratic FBI agent investigates the murder of a young woman in the even more idiosyncratic town of Twin Peaks.
